{
  "$schema": "../theme.schema.json",
  "name": "Fresh",
  "description": "A crisp, airy theme with sky-blue accents, Nunito body text (ExtraBold headings), Baskerville display typography, and a cool mint gradient background. Apply class=\"a1-theme-fresh\" to <html>.",
  "selectors": [
    {
      "selector": ".a1-theme-fresh",
      "overrides": "overrides/default.json"
    }
  ],
  "labels": {}
}
