{
  "$schema": "../theme.schema.json",
  "name": "Base",
  "description": "Global baseline — ensures body and .a1-inverse paint their background from the active surface token.",
  "selectors": [
    {
      "selector": "body, .a1-inverse",
      "styles": "styles/default.json"
    }
  ],
  "labels": {}
}
